[
  {
    "id": "stance",
    "name": "Ready stance",
    "style": "foundations",
    "difficulty": 1,
    "requires": [],
    "description": "Knees bent, chest up, weight over the middle of the feet. Everything else is built on this.",
    "cues": [
      "Nose over knees over toes",
      "Feet hip-width, slightly staggered",
      "Soft knees, never locked"
    ]
  },
  {
    "id": "fall",
    "name": "Falling safely & getting up",
    "style": "foundations",
    "difficulty": 1,
    "requires": [],
    "description": "Fall forward onto your pads, slide it out, and stand back up through a kneel.",
    "cues": [
      "Get low before you go down",
      "Knee pads first, then wrist guards, and slide",
      "Up: one knee, other skate flat, hands on knee, stand"
    ]
  },
  {
    "id": "stride",
    "name": "Forward stride",
    "style": "foundations",
    "difficulty": 1,
    "requires": ["stance"],
    "description": "Push out to the side and recover under the hips, alternating feet.",
    "cues": [
      "Push sideways, not backwards",
      "Bring the foot back under you before the next push",
      "Fully extend the pushing leg"
    ]
  },
  {
    "id": "swizzle",
    "name": "Forward swizzles",
    "style": "foundations",
    "difficulty": 1,
    "requires": ["stance"],
    "description": "Two-foot lemon shapes: heels in, toes out, then squeeze back together.",
    "cues": [
      "Press out through the heels, pull in with the inner thighs",
      "Stay low the whole time"
    ]
  },
  {
    "id": "glide1",
    "name": "One-foot glide",
    "style": "foundations",
    "difficulty": 2,
    "requires": ["stride"],
    "description": "Hold a balanced glide on one foot for several seconds, both sides.",
    "cues": [
      "Hips stacked over the gliding skate",
      "Free foot lifted beside the ankle",
      "Aim for 5 seconds, then 10"
    ]
  },
  {
    "id": "aframe",
    "name": "A-frame turn",
    "style": "foundations",
    "difficulty": 1,
    "requires": ["stride"],
    "description": "Wide-stance turn steered by pressing the outside skate onto its inside edge.",
    "cues": [
      "Feet wider than shoulders",
      "Look and point where you are going",
      "Weight on the outside foot"
    ]
  },
  {
    "id": "hop",
    "name": "Two-foot hop",
    "style": "foundations",
    "difficulty": 2,
    "requires": ["stride"],
    "description": "Jump off both skates while rolling and land balanced.",
    "cues": [
      "Bend deep, spring, absorb the landing",
      "Land knees soft, feet hip-width",
      "Arms forward for balance"
    ]
  },
  {
    "id": "plow",
    "name": "Plow stop",
    "style": "foundations",
    "difficulty": 2,
    "requires": ["swizzle"],
    "description": "Push skates out into a wide V (inline) or pigeon-toe (quad) and scrub off speed.",
    "cues": [
      "Wide stance, then press the heels out",
      "Low hips, push into the ground",
      "Start slow, then add speed"
    ]
  },
  {
    "id": "heelstop",
    "name": "Heel brake stop",
    "style": "foundations",
    "difficulty": 1,
    "requires": ["stride"],
    "skates": ["heel"],
    "description": "Scissor the braking foot forward and lift its toe to press the heel brake.",
    "cues": [
      "Brake foot forward until knees overlap",
      "Lift the toe and press down through the heel",
      "Most weight stays on the back leg"
    ]
  },
  {
    "id": "toedrag",
    "name": "Toe-stop drag",
    "style": "foundations",
    "difficulty": 2,
    "requires": ["glide1"],
    "skates": ["toe"],
    "description": "Glide on one foot and drag the other toe stop behind you to slow down.",
    "cues": [
      "Drag foot turned out, behind the glide foot",
      "Weight stays on the front leg",
      "Press gradually"
    ]
  },
  {
    "id": "tstop",
    "name": "T-stop",
    "style": "foundations",
    "difficulty": 2,
    "requires": ["glide1"],
    "description": "Drag the back skate at a right angle behind the glide skate to brake.",
    "cues": [
      "Glide foot straight, knee bent",
      "Back skate at 90° behind the heel",
      "Light drag first, then add pressure"
    ]
  },
  {
    "id": "edges",
    "name": "Inside & outside edges",
    "style": "foundations",
    "difficulty": 2,
    "requires": ["glide1"],
    "description": "Hold curves on each edge of each foot. These are the base of every turn and crossover.",
    "cues": [
      "Lean ankle and knee together",
      "Outside edges are the hard ones, so go slow",
      "Draw half-circles along a line"
    ]
  },
  {
    "id": "parallel",
    "name": "Parallel turn",
    "style": "foundations",
    "difficulty": 2,
    "requires": ["aframe", "glide1"],
    "description": "Turn with skates close together, leaning on matching edges.",
    "cues": [
      "Inside skate slightly ahead",
      "Lean from the ankles, not the shoulders",
      "Shoulders rotate into the turn first"
    ]
  },
  {
    "id": "bswizzle",
    "name": "Backward swizzles",
    "style": "foundations",
    "difficulty": 2,
    "requires": ["swizzle"],
    "description": "Lemons rolling backwards: toes in, heels out.",
    "cues": [
      "Look over one shoulder",
      "Weight on the balls of the feet",
      "Small lemons first"
    ]
  },
  {
    "id": "twofootturn",
    "name": "Two-foot turn",
    "style": "foundations",
    "difficulty": 2,
    "requires": ["bswizzle", "parallel"],
    "description": "Turn from forward to backward (and back) on both skates while rolling.",
    "cues": [
      "Shoulders rotate first, hips follow",
      "Stay centred over both skates",
      "Practise both directions"
    ]
  },
  {
    "id": "bstride",
    "name": "Backward C-cuts",
    "style": "foundations",
    "difficulty": 3,
    "requires": ["bswizzle"],
    "description": "Backward pushes drawing C shapes with alternating skates.",
    "cues": [
      "Push from the front wheels outward",
      "Keep hips square to your line",
      "Check behind you every few strides"
    ]
  },
  {
    "id": "crossfwd",
    "name": "Forward crossovers",
    "style": "foundations",
    "difficulty": 3,
    "requires": ["edges", "parallel"],
    "description": "Step the outside skate over the inside one around a curve.",
    "cues": [
      "Power comes from the under-leg on its outside edge",
      "Lift and place the crossing skate, don’t swing it",
      "Shoulders face into the circle"
    ]
  },
  {
    "id": "mohawk",
    "name": "Mohawk turn",
    "style": "foundations",
    "difficulty": 3,
    "requires": ["twofootturn", "edges"],
    "description": "Step from forward to backward onto the other foot, heels pointing at each other.",
    "cues": [
      "Open the free heel toward the gliding heel",
      "Hips open like a door",
      "Smooth weight transfer"
    ]
  },
  {
    "id": "bcross",
    "name": "Backward crossovers",
    "style": "foundations",
    "difficulty": 4,
    "requires": ["bstride", "crossfwd"],
    "description": "Cross the front skate over while skating backwards around a curve.",
    "cues": ["The under-push is the power", "Look into the circle", "Hips low and level"]
  },
  {
    "id": "powerslide",
    "name": "Powerslide",
    "style": "foundations",
    "difficulty": 4,
    "requires": ["bstride", "mohawk"],
    "description": "Skate backwards, then open into a sideways slide on the leading skate to stop.",
    "cues": [
      "Commit your weight to the sliding leg",
      "Lead with the shoulders",
      "Learn it on smooth ground"
    ]
  },
  {
    "id": "smallobst",
    "name": "Hop over an obstacle",
    "style": "foundations",
    "difficulty": 2,
    "requires": ["hop"],
    "description": "Clear a small object, like a shoe or a stick, while rolling.",
    "cues": [
      "Pick your take-off spot",
      "Lift the knees, don’t just pull the feet up",
      "Look past the object"
    ]
  },
  {
    "id": "rough",
    "name": "Rolling on rough ground",
    "style": "cruising",
    "difficulty": 2,
    "requires": ["stride"],
    "surfaces": ["rough", "smooth", "park"],
    "description": "Stay loose over cracks, pebbles and patched asphalt.",
    "cues": [
      "Lower stance, one foot slightly ahead",
      "Weight back a touch over cracks",
      "Soft knees are your suspension"
    ]
  },
  {
    "id": "longstride",
    "name": "Long efficient stride",
    "style": "cruising",
    "difficulty": 2,
    "requires": ["glide1"],
    "description": "Fewer, longer pushes with a full glide on each foot.",
    "cues": [
      "Glide until speed drops, then push",
      "Full extension, low recovery",
      "Count strides per lap and cut the number"
    ]
  },
  {
    "id": "endurance",
    "name": "Steady endurance skate",
    "style": "cruising",
    "difficulty": 2,
    "requires": ["stride"],
    "description": "Twenty minutes or more at a steady effort, holding form as you tire.",
    "cues": ["Conversation pace", "Check your knee bend every lap", "Drink water"]
  },
  {
    "id": "curbdrop",
    "name": "Rolling off a curb",
    "style": "cruising",
    "difficulty": 2,
    "requires": ["hop", "stance"],
    "needs": [["curb"]],
    "description": "Roll off a curb without slowing down or stepping.",
    "cues": [
      "Staggered stance, front foot leads off",
      "Bend as you drop to absorb",
      "Stay over your feet"
    ]
  },
  {
    "id": "hills",
    "name": "Hill speed control",
    "style": "cruising",
    "difficulty": 3,
    "requires": ["parallel", "tstop"],
    "needs": [["slope"]],
    "description": "Use slalom turns and drags to stay in control going downhill.",
    "cues": [
      "Wide carves scrub speed",
      "Never outrun your stopping ability",
      "Start on gentle slopes"
    ]
  },
  {
    "id": "intervals",
    "name": "Sprint intervals",
    "style": "cruising",
    "difficulty": 3,
    "requires": ["longstride", "crossfwd"],
    "needs": [["space"]],
    "description": "Short hard efforts with easy recovery laps.",